{
  "schemaVersion": 1,
  "id": "Divider",
  "slug": "divider",
  "category": "layout",
  "tags": [],
  "status": {
    "state": "undocumented",
    "guideCommit": null,
    "packageVersion": "0.1.78",
    "builtAt": "2026-10-28T23:26:25Z",
    "flags": []
  },
  "summary": "Divider component that renders a horizontal or vertical separator line. This component is used to visually separate content sections. (Package docs; Coin has no designer guide for Divider.)",
  "useWhen": [],
  "avoidWhen": [],
  "anatomy": [],
  "allowedChildren": [],
  "placementAdvice": [],
  "configuration": [],
  "content": {
    "rules": [],
    "good": [],
    "bad": []
  },
  "states": [],
  "accessibility": [],
  "doDont": [],
  "examples": [
    {
      "purpose": "A horizontal separator between two sections.",
      "jsx": "<Divider direction=\"horizontal\" modes={{ 'Color Mode': 'Light' }} />",
      "from": null
    }
  ],
  "facts": {
    "props": [
      {
        "name": "direction",
        "type": "DividerDirection",
        "required": false,
        "source": "types",
        "values": [
          "vertical",
          "horizontal"
        ],
        "default": "horizontal",
        "description": "Direction of the divider line. - 'horizontal': renders a horizontal line (default) - 'vertical': renders a vertical line. Default \"horizontal\", from the component source."
      },
      {
        "name": "modes",
        "type": "Modes",
        "required": false,
        "source": "types",
        "description": "Mode configuration passed to the token resolver."
      },
      {
        "name": "style",
        "type": "StyleProp<ViewStyle>",
        "required": false,
        "source": "types",
        "description": "Optional style overrides for the divider."
      },
      {
        "name": "accessibilityLabel",
        "type": "string",
        "required": false,
        "source": "types",
        "description": "Accessibility label for the divider."
      }
    ],
    "modes": [
      {
        "name": "Color Mode",
        "type": "mode collection",
        "values": [
          "Light",
          "Dark"
        ],
        "description": "A token collection Divider reads (the package's FIGMA_COMPONENT_MODES). When modes leave it unset, the resolver uses the collection's default mode.",
        "source": "types",
        "default": "Light"
      },
      {
        "name": "context 10",
        "type": "mode collection",
        "values": [
          "Default",
          "jioPlus"
        ],
        "description": "A token collection Divider reads (the package's FIGMA_COMPONENT_MODES). When modes leave it unset, the resolver uses the collection's default mode.",
        "source": "types",
        "default": "Default"
      },
      {
        "name": "Profile Card Appearance",
        "type": "mode collection",
        "values": [
          "Default",
          "Premium"
        ],
        "description": "A token collection Divider reads (the package's FIGMA_COMPONENT_MODES). When modes leave it unset, the resolver uses the collection's default mode.",
        "source": "types",
        "default": "Default"
      }
    ],
    "slots": [],
    "events": [],
    "gaps": []
  },
  "sources": {
    "guide": null,
    "figma": null,
    "storybook": "https://jfs-components-storybook.vercel.app/?path=/docs/components-divider--docs"
  }
}
