{
  "schemaVersion": 1,
  "id": "Icon",
  "slug": "icon",
  "category": "content",
  "tags": [],
  "status": {
    "state": "undocumented",
    "guideCommit": null,
    "packageVersion": "0.1.78",
    "builtAt": "2026-10-29T04:33:30Z",
    "flags": []
  },
  "summary": "Icon component — a design-token-driven wrapper around a single glyph. (Package docs; Coin has no designer guide for Icon.)",
  "useWhen": [],
  "avoidWhen": [],
  "anatomy": [],
  "allowedChildren": [
    {
      "slot": "children",
      "accepts": [
        "ReactNode"
      ],
      "source": "types"
    }
  ],
  "placementAdvice": [],
  "configuration": [],
  "content": {
    "rules": [],
    "good": [],
    "bad": []
  },
  "states": [],
  "accessibility": [],
  "doDont": [],
  "examples": [
    {
      "purpose": "A registry icon resolved through modes.",
      "jsx": "<Icon iconName=\"ic_card\" modes={{ 'Color Mode': 'Light' }} />",
      "from": null
    }
  ],
  "facts": {
    "props": [
      {
        "name": "iconName",
        "type": "string",
        "required": false,
        "source": "types",
        "description": "Built-in icon name from the registry, in the `ic_something` format (e.g. `'ic_card'`, `'ic_scan_qr_code'`). When omitted and no `source` or `children` slot is supplied, defaults to `'ic_card'` to match the Figma design's default glyph."
      },
      {
        "name": "source",
        "type": "UnifiedSource",
        "required": false,
        "source": "types",
        "description": "Unified fallback source rendered when `iconName` is missing or not in the registry. Accepts a remote URI, an inline SVG XML string, a `require()` asset, an SVG React component, or an already-rendered element. The media is tinted with the mode-resolved icon color so it follows design tokens just like a built-in icon. See {@link UnifiedSource}."
      },
      {
        "name": "children",
        "type": "React.ReactNode",
        "required": false,
        "source": "types",
        "description": "Icon slot. Render any node here (another `Icon`, a custom SVG component, etc.) and it takes precedence over `iconName`/`source`. `modes` cascade into the slotted children automatically."
      },
      {
        "name": "color",
        "type": "string",
        "required": false,
        "source": "types",
        "description": "Override the mode-resolved icon color. When omitted the value comes from the `icon/color` design token."
      },
      {
        "name": "size",
        "type": "number",
        "required": false,
        "source": "types",
        "description": "Override the mode-resolved icon size (in px). When omitted the value comes from the `icon/size` design token."
      },
      {
        "name": "modes",
        "type": "Modes",
        "required": false,
        "source": "types"
      },
      {
        "name": "style",
        "type": "StyleProp<ViewStyle>",
        "required": false,
        "source": "types"
      },
      {
        "name": "...AccessibilityProps",
        "type": "AccessibilityProps",
        "description": "Inherited React Native props the component also accepts. They are not part of the design contract and no guide documents them.",
        "source": "types"
      }
    ],
    "modes": [
      {
        "name": "AppearanceBrand",
        "type": "mode collection",
        "values": [
          "Primary",
          "Secondary",
          "Neutral",
          "Tertiary"
        ],
        "description": "A token collection Icon reads (the package's FIGMA_COMPONENT_MODES). When modes leave it unset, the resolver uses the collection's default mode.",
        "source": "types",
        "default": "Primary"
      },
      {
        "name": "AppearanceSystem",
        "type": "mode collection",
        "values": [
          "positive",
          "warning",
          "negative"
        ],
        "description": "A token collection Icon reads (the package's FIGMA_COMPONENT_MODES). When modes leave it unset, the resolver uses the collection's default mode.",
        "source": "types",
        "default": "positive"
      },
      {
        "name": "Badge Size",
        "type": "mode collection",
        "values": [
          "Medium",
          "Small"
        ],
        "description": "A token collection Icon reads (the package's FIGMA_COMPONENT_MODES). When modes leave it unset, the resolver uses the collection's default mode.",
        "source": "types",
        "default": "Medium"
      },
      {
        "name": "Color Mode",
        "type": "mode collection",
        "values": [
          "Light",
          "Dark"
        ],
        "description": "A token collection Icon reads (the package's FIGMA_COMPONENT_MODES). When modes leave it unset, the resolver uses the collection's default mode.",
        "source": "types",
        "default": "Light"
      },
      {
        "name": "context 10",
        "type": "mode collection",
        "values": [
          "Default",
          "jioPlus"
        ],
        "description": "A token collection Icon reads (the package's FIGMA_COMPONENT_MODES). When modes leave it unset, the resolver uses the collection's default mode.",
        "source": "types",
        "default": "Default"
      },
      {
        "name": "Context4",
        "type": "mode collection",
        "values": [
          "Default",
          "Chip",
          "Button",
          "Badge",
          "Badge/glass"
        ],
        "description": "A token collection Icon reads (the package's FIGMA_COMPONENT_MODES). When modes leave it unset, the resolver uses the collection's default mode.",
        "source": "types",
        "default": "Default"
      },
      {
        "name": "Emphasis",
        "type": "mode collection",
        "values": [
          "High",
          "Medium",
          "Low"
        ],
        "description": "A token collection Icon reads (the package's FIGMA_COMPONENT_MODES). When modes leave it unset, the resolver uses the collection's default mode.",
        "source": "types",
        "default": "High"
      },
      {
        "name": "Icon Size",
        "type": "mode collection",
        "values": [
          "Medium",
          "Small"
        ],
        "description": "A token collection Icon reads (the package's FIGMA_COMPONENT_MODES). When modes leave it unset, the resolver uses the collection's default mode.",
        "source": "types",
        "default": "Medium"
      },
      {
        "name": "Profile Card Appearance",
        "type": "mode collection",
        "values": [
          "Default",
          "Premium"
        ],
        "description": "A token collection Icon reads (the package's FIGMA_COMPONENT_MODES). When modes leave it unset, the resolver uses the collection's default mode.",
        "source": "types",
        "default": "Default"
      },
      {
        "name": "Semantic Intent",
        "type": "mode collection",
        "values": [
          "Brand",
          "System"
        ],
        "description": "A token collection Icon reads (the package's FIGMA_COMPONENT_MODES). When modes leave it unset, the resolver uses the collection's default mode.",
        "source": "types",
        "default": "Brand"
      }
    ],
    "slots": [
      {
        "name": "children",
        "type": "React.ReactNode",
        "description": "Icon slot. Render any node here (another `Icon`, a custom SVG component, etc.) and it takes precedence over `iconName`/`source`. `modes` cascade into the slotted children automatically.",
        "source": "types"
      }
    ],
    "events": [],
    "gaps": []
  },
  "sources": {
    "guide": null,
    "figma": null,
    "storybook": "https://jfs-components-storybook.vercel.app/?path=/docs/components-icon--docs"
  }
}
